{
  "schemaVersion": "1.0",
  "documentType": "teaching_deck",
  "title": "老年住院患者跌倒预防与护理安全管理",
  "speaker": "护理教学示例",
  "date": "2026-06-25",
  "goals": [
    "识别跌倒高危因素",
    "掌握风险评估流程",
    "执行护理干预措施"
  ],
  "chapters": [
    {
      "id": "chapter-1",
      "label": "第一部分",
      "title": "护理执行",
      "contentTitle": "将预防措施嵌入每班工作",
      "items": [
        { "heading": "主动巡视", "body": "询问排尿、疼痛、眩晕和下床需求。" },
        { "heading": "起立三步", "body": "协助患者从卧位、坐位到站立逐步转换。" },
        { "heading": "转运陪护", "body": "确认轮椅刹车、管路固定、鞋袜防滑和陪检交接。" },
        { "heading": "家属协同", "body": "说明陪护禁忌、呼叫时机和夜间如厕协助方式。" },
        { "heading": "用药观察", "body": "关注镇静、降压、利尿和降糖药物后的体位变化。" },
        { "heading": "夜间照明", "body": "保留柔和照明，减少摸黑起床和方向判断错误。" },
        { "heading": "辅具检查", "body": "确认床栏、防滑鞋、助行器和轮椅刹车正确使用。" },
        { "heading": "交接闭环", "body": "班班交接风险等级、主要诱因和当班观察重点。" },
        { "heading": "记录追踪", "body": "将巡视、宣教和异常情况记录到护理文书。" }
      ]
    }
  ],
  "summary": [
    "护理执行要嵌入每班流程",
    "长内容可以由模板引擎自动拆页"
  ],
  "evaluations": [
    {
      "title": "教学评价",
      "items": ["理论提问", "操作演示"]
    }
  ]
}
