{
  "schemaVersion": "1.0",
  "documentType": "teaching_deck",
  "title": "示例护理教学课程",
  "speaker": "讲者姓名",
  "date": "2026-06-21",
  "goals": [
    "说明课程核心概念",
    "掌握关键流程",
    "识别常见风险"
  ],
  "chapters": [
    {
      "id": "chapter-1",
      "label": "第一部分",
      "title": "课程概述",
      "contentTitle": "课程概述",
      "items": [
        {
          "heading": "背景",
          "body": "说明课程场景和学习对象。"
        },
        {
          "heading": "重点",
          "body": "聚焦临床工作中最需要掌握的知识点。"
        },
        {
          "heading": "方法",
          "body": "使用讲授、案例和操作演示结合的方式。"
        }
      ]
    }
  ],
  "summary": [
    "围绕核心流程组织教学内容",
    "用评价结果检验学习目标"
  ],
  "evaluations": [
    {
      "title": "教学评价（一）",
      "items": ["理论提问", "操作回演示"]
    },
    {
      "title": "教学评价（二）",
      "items": ["情景模拟", "临床转化反馈"]
    }
  ]
}
